{
  "schemaVersion": "commentary-v2-run-v1",
  "runId": "s100-1-gpt55-high",
  "surah": 100,
  "language": "tr",
  "outputRoot": "_commentary/v2/generated/s100-1-gpt55-high",
  "ayahSources": {
    "100:1": [
      "_commentary/work/hft-default/s100/100_1.ayah.json"
    ]
  },
  "governingSources": [
    "PRINCIPLES.md",
    "COMMENTARY_SPEC.md"
  ],
  "pericopes": [
    {
      "id": "single-ayah",
      "ayahs": [
        1
      ]
    }
  ]
}
